[
  {
    "id": "14141414-1414-4141-8141-141414141414",
    "siteId": "11111111-1111-4111-8111-111111111111",
    "type": "fermentation",
    "lotId": "66666666-6666-4666-8666-666666666666",
    "tankId": "33333333-3333-4333-8333-333333333333",
    "operatorId": "aaaaaaaa-aaaa-4aaa-8aaa-aaaaaaaaaaaa",
    "startedAt": "2026-05-18T08:00:00.000Z",
    "notes": "Suivi fermentation lente",
    "createdAt": "2026-05-18T09:00:00.000Z",
    "updatedAt": "2026-05-18T09:00:00.000Z"
  }
]

